"Yeah, hahahaha...whooooo, shit!"
Tuh-took a genius (to) take us the fuck outta here
The Wu is too slamming for these Cold Killing labels
Some ain't had hits since I seen Aunt Mabel
Be doing artists in like Cain did Abel
Now they money's gettin stuck to the gum under the table
That's what you get when you misuse what I invent
Your empire falls and you lose every cent
For trying to blow up a scrub
Now that thought was just as bright as a 20-watt light bulb
Should've pumped it when I rocked it
Niggaz so stingy they got short arms and deep pockets
This goes on in some companies
With majors they're scared to death to pump these
"First of all, who's your A&R"
A mountain climber who plays an electric guitar
But he don't know the meaning of dope
When he's looking for a suit and tie rap
that's cleaner than a bar of soap
And I'm the dirtiest thing in sight
Matter of fact bring out the girls and let's have a mud fight
You take Sally and I'll take Sue
There ain't no difference between the two
"Cocaine, running all 'round my brain"
"Headin' down Scott, turnin' up Main"
Looking for that girl who sells cocaine
"Cocaine, runnin' all 'round my brain"
Mmm momma come here quick
That old Cocaine 'bout to make me sick
"Cocaine, runnin' all 'round my brain"
Late last night about a quarter past four
Ladanyi come knockin' down my hotel room door
Where's the cocaine?
It's runnin' all 'round my brain
I was talking to my doctor down at the hospital
"He said, ""Son, it says here you're twenty-seven"
But that's impossible ...
"(Cocaine) You look like you could be forty-five."""
Now I'm losing touch with reality and I'm almost out of blow
It's such a fine line I hate to see it go
"Cocaine, runnin' all 'round my brain"
I heard somebody fixed today
There was no last goodbyes to say
His will to live ran out
I heard somebody turned to dust
Looking back at what he left
A list of plans and photographs
Songs that never will be sung
These are the things he don't get done
"I've seen the man use the needle, seen the needle use the man"
I've seen them crawl from the cradle to the gutter on their hands
"They fight a war but it's fatal, it's so hard to understand"
"I've seen the man use the needle, seen the needle use the man"
Just one shot to say goodbye
One last taste to mourn and cry
"Scores and shoots, the lights go dim"
Just one shot to do him in
He hangs his head and wonders why
Why the monkey only lies
"But pay the pauper, he did choose"
He hung his head inside the noose
"I've seen the man use the needle, seen the needle use the man"
I've seen them crawl from the cradle to the gutter on their hands
"They fight a war but it's fatal, it's so hard to understand"
"I've seen the man use the needle, seen the needle use the man"
"Cryptic writing on the wall, the beginning of the end"
"I've seen myself use the needle, seen the needle in my hand"
Blood keeps drinking away
Certain of its destination
Driving through new orleans at night
Gotta find a destination
Just one fix
Life keeps slipping away
Fighting in a war with damnation
"Poised, keep cutting away"
I'm looking in through to salvation
Just one fix
Like if I boarded a train
Trying to take in another station
Join us and the choice will be made
Unless we kill the lie as a nation
[Roll up! Roll up for the magical mystery tour!
Step right this way!]
"Roll up, roll up for the mystery tour"
"Roll up, roll up for the mystery tour"
"Roll up (And that's an invitation), roll up for the mystery tour"
"Roll up (To make a reservation), roll up for the mystery tour"
The magical mystery tour is waiting to take you away
Waiting to take you away
"Roll up, roll up for the mystery tour"
"Roll up, roll up for the mystery tour"
"Roll up (We've got everything you need), roll up for the mystery tour"
"Roll up (Satisfaction guaranteed), roll up for the mystery tour"
The magical mystery tour is hoping to take you away
Hoping to take you away
Mystery trip
Aaaah... the magical mystery tour
"Roll up, roll up for the mystery tour"
"Roll up (And that's an invitation), roll up for the mystery tour"
"Roll up (To make a reservation), roll up for the mystery tour"
The magical mystery tour is coming to take you away
Coming to take you away
The magical mystery tour is dying to take you away
"Dying to take you away, take you today"
"Welcome, to some shit that’s considered legendary"
I’m here to put the rap game in the cemetery
They told me it couldn’t happen
Ain’t no way in hell you gon' make millions off of rapping
But I’m just so determined
Catch me on the stage spitting verses like a sermon
You know I had to make 'em realize
"Lights, camera, action, mofucker check the real in my eyes"
Now they all looking so surprised
"The dawn of a new era, like the sun I arise"
"Through these lyrics, I am immortalized"
Strictly spitting the truth but the rest is telling more lies
This the type of shit most people fantasize
But this the shit I used to analyze
They told me I was too underground
So I took the mic out my basement and found another sound
"I want it, I need it, I’m coming for the crown"
"Can’t nobody stop me, I’m Rocky lets go another round"
I’m kinda on my Roc-A-Fella meets Nelson Mandela
"Raining money, no umbrella flow"
Most of these people they will never know
What you have to sacrifice as a person to truly grow
See I'm in love with this shorty right
But first I gotta get this story right
Cause in this business love will never last
"Sold out shows, hoes, and a whole lot of ass"
Damn what a concoction
But these hoes ain't an option
Cause a woman what I'm looking for
A girl with wisdom that give me brain so insane
Or maybe I'm just going insane
"On the road to success, so I'm living in the fast lane"
"You gotta be hustling, like"
You gotta treat this like you selling drugs...
It's ya boy yo gotti
Chea
Gucci mane the flare
My nigga Ralph in here
Zaytoven on the beat nigga
And it's a street nigga holiday
My Nigga D.J Holiday
Chea
Bricks
All white bricks
Off white bricks
Light tan bricks
"Just hit a lick, For 50 more bricks"
"Balling like a bitch, with all these bricks"
Bricks
36 zips
That's a whole chick
Wanna bad bitch? Gotta have bricks
Yea that make sense
Yea I make hits
But I still take bricks
"So icy c.e.o, I'm a fool with the snow"
They think I'm puttin' v.v.s jewels in the coke
"My watch a cool hundred, Paint-job a cold 20"
"And after this flip I'm quittin' the trap cold turkey, Sike!"
The pack in and I'm workin'
"Drought season in, charged ya ass a whole 30"
But right now you can get it for a low number
"The fish scale white, Same color my hummer"
Zone 6 polar bears never see summer
It's winter all year cause the birds fly under
95' Air Max cause I'm a dope runna'
I'm ballin' like an athlete but got no jumper I'ts
Bricks
All white bricks
Off white bricks
Light tan bricks
Just hit a lick
For 50 more bricks
"Balling like a bitch, with all these bricks"
Bricks
36 zips
That's a whole chick
Wanna bad bitch? Gotta have bricks
Yea that make sense
Yea I make hits
But I still take bricks
I'm like a waitress in the trap I got somethin' to serve
"That's 16 bars, Same price for a bird"
What you need a bird?
Or A Couple Pounds?
"I'm on Cleveland Ave, You know my side of town"
So many bricks I can build my own apartment
"Ya better a check, When ya come in my department"
Yes I break em' down
"And I sell em' whole, Try me watch ya whole crew fall like some dominoes"
I got a trap house
And a trap car
"100, 00 off a cap, That's a trap star"
All this smoke got me feelin' real nauseous
Ridin' with them bricks got me feelin' real cautious
Bricks
All white bricks
Off white bricks
Light tan bricks
Just hit a lick
For 50 more bricks
"Balling like a bitch, with all these bricks"
Bricks
36 zips
That's a whole chick
Wanna bad bitch? Gotta have bricks
Yea that make sense
Yea I make hits
But I still take bricks
"Tony Montana, All I have in this world"
Is my 100 round chopper and my white girl
"Oil base bricks, Shit hard to cook"
"Call the plug back, Tell him he got took"
Know what that mean? The shit free
"That mean none for him, And more for me"
"I took somethin', I'm gutta bitch"
"Don't trust me dog, This that North Memphis shit"
"Old school, New Porsche"
Couple choppas just in case they wanna go to war bricks
A.k.a my best friend
28 inch rims call em' grown men
"Dope stepped on, Call it step child"
"I got that Slim Shady, We call it 8 Mile"
"I'm from North Memphis, Watkins and Brown"
"Gotti Street, And nigga that's my brick house"
Bricks
All white bricks
Off white bricks
Light tan bricks
Just hit a lick
For 50 more bricks
"Balling like a bitch, with all these bricks"
Bricks
36 zips
That's a whole chick
Wanna bad bitch? Gotta have bricks
Yea that make sense
Yea I make hits
But I still take bricks
Host: I've heard whispers about the financial support
your government receives from the drug industry.
"Guest: Well, the irony of this, of course, is that"
"this money, which is in the billions, is coming from"
"your country. You see, you are the major purchaser of"
"our national product, which is of course cocaine."
"Host: On one hand, you're saying the United States"
government is spending millions of dollars to
eliminate the flow of drugs onto our streets. At the
"same time, we are doing business with the very same"
government that is flooding our streets with cocaine.
"Guest: Mmm-hmm, si, si. Let me show you a few other"
characters that are involved in this tragic comedy.
"Guest: Mmm-hmm, si, si. Let me show you a few other"
characters that are involved in this tragic comedy.
*Two Men Speak in Spanish*
"I'm on the border of Bolivia, working for pennies"
"Treated like a slave, the coke fields have to be ready"
"The spirit of my people is starving, broken and sweaty"
Dreaming about revolution (REVOLUTION!) looking at my machete
But the workload is too heavy to rise up in arms
"And if I ran away, I know they'd probably murder my moms"
"So I pray to ""Heso Preisto"" when I go to the mission"
"Process the cocaine, paced and play my position"
"Ok, listen while I'm out there, just give me my product"
Before we chop off ya hands for worker's misconduct
"I got the power to shoot a copper, and not get charged"
And it would be sad to see your family in front of a firing squad
"So to feed your kids, I need these bricks"
"40 tons in total, let me test it, indeed I (*sniff*)"
"Shit, this is good, pass me a tissue"
"And don't worry about them, I paid off the officials"
"Yo, it don't come as a challenge, I'm the son of some of the foulest"
